{
  "contractVersion": "1.0.0",
  "profile": "ComprehensiveLocalAssessment",
  "outputDestination": "./WIN-PCInfo-Results",
  "networkBehavior": "MicrosoftConnectivityEnabled",
  "updateChoice": "NoUpdateCheck",
  "diagnosticLevel": "Standard",
  "automationChoices": {
    "allowAssessmentNetwork": true,
    "allowElevation": true,
    "allowInstallation": false,
    "allowPersistentChanges": false,
    "allowStaleRecovery": false,
    "verificationOverride": "None"
  }
}
